{
  "id": "ex.action-mcq",
  "type": "mcq",
  "skillId": "skill.actions",
  "prompt": "Que représente une action ?",
  "difficulty": "easy",
  "validation": { "correctIndex": 1 },
  "feedback": {
    "correct": "Exact — détenir une action, c’est posséder une fraction de l’entreprise.",
    "incorrect": "Pas tout à fait : une action n’est ni un prêt ni une monnaie.",
    "rule": "Une action = une part d’entreprise."
  },
  "sources": ["WMB — Glossaire : Action"]
}
